{
  "event_id": "70000000-0000-4000-8000-000000000001",
  "message_type": "rl.run.requested.v1",
  "schema_version": "1.0",
  "occurred_at": "2026-08-14T12:00:00Z",
  "correlation_id": "70000000-0000-4000-8000-000000000002",
  "causation_id": "70000000-0000-4000-8000-000000000003",
  "run_id": "70000000-0000-4000-8000-000000000004",
  "attempt": 1,
  "payload": {
    "environment_id": "11111111-1111-4111-8111-111111111101",
    "environment_version": "1.0.0",
    "policy_id": "22222222-2222-4222-8222-222222222201",
    "policy_algorithm": "q-learning",
    "policy_sha256": "aaaaaaaaaaaaaaaaaaaaaaaaaaaaaaaaaaaaaaaaaaaaaaaaaaaaaaaaaaaaaaaa",
    "seed": 37,
    "max_steps": 80
  }
}
